{
  "apiVersion": "decision.antaeus.io/v0alpha1",
  "kind": "Decision",
  "outcome": "allow",
  "policy": {
    "name": "vendor-onboarding",
    "digest": "sha256:2378b5a1806bb11c618bd3a78122e773ec93bdfc45b751a18887d40f4ea536a2",
    "version": "2026-09-22.1"
  },
  "ruleResults": [
    {
      "ruleId": "prohibited-service",
      "status": "not_matched",
      "reasonCodes": [
        "policy.rule_not_matched"
      ]
    },
    {
      "ruleId": "complete-low-risk-submission",
      "status": "matched",
      "outcome": "allow",
      "reasonCodes": [
        "policy.rule_matched"
      ]
    }
  ],
  "reasonCodes": [
    "policy.allow_rule_matched"
  ],
  "extensions": {
    "io.antaeus.execution": {
      "version": "v0alpha1",
      "attempts": [
        {
          "evaluatorId": "semantic-primary",
          "adapterId": "io.antaeus.systemone",
          "adapterVersion": "0.4.0",
          "route": "primary",
          "attempt": 1,
          "ruleIndexes": [
            0,
            1
          ],
          "code": "evaluation.succeeded",
          "latencyMs": 12,
          "provider": "drex",
          "requestedModel": "drex-latest",
          "resolvedModel": "drex-latest",
          "revisionAvailable": false
        }
      ],
      "terminal": "completed"
    },
    "io.antaeus.usage": {
      "version": "v0alpha1",
      "attempts": [
        {
          "traceIndex": 0,
          "status": "reported",
          "inputTokens": 575,
          "outputTokens": 48
        }
      ]
    }
  }
}
