{
  "apiVersion": "decision.antaeus.io/v0alpha1",
  "kind": "Decision",
  "outcome": "review",
  "policy": {
    "name": "vendor-onboarding",
    "digest": "sha256:2378b5a1806bb11c618bd3a78122e773ec93bdfc45b751a18887d40f4ea536a2"
  },
  "ruleResults": [
    {
      "ruleId": "prohibited-service",
      "status": "not_matched",
      "reasonCodes": ["policy.rule_not_matched"]
    },
    {
      "ruleId": "complete-low-risk-submission",
      "status": "not_matched",
      "reasonCodes": ["policy.rule_not_matched"]
    }
  ],
  "reasonCodes": ["policy.default_outcome"]
}
